# PostgreSQL transition relations are statement-local typed relations, not
# text substitutions. Keep all three DML shapes in the SQLLogicTest replay.

statement ok
CREATE TABLE slt_transition_target (id integer PRIMARY KEY, value integer)

statement ok
CREATE TABLE slt_transition_audit (kind text, id integer, value integer)

statement ok
CREATE FUNCTION slt_transition_insert() RETURNS trigger LANGUAGE plpgsql AS
'BEGIN INSERT INTO slt_transition_audit SELECT ''insert'', id, value FROM inserted_rows; RETURN NULL; END'

statement ok
CREATE FUNCTION slt_transition_update() RETURNS trigger LANGUAGE plpgsql AS
'BEGIN INSERT INTO slt_transition_audit SELECT ''update-old'', id, value FROM old_rows; INSERT INTO slt_transition_audit SELECT ''update-new'', id, value FROM new_rows; RETURN NULL; END'

statement ok
CREATE FUNCTION slt_transition_delete() RETURNS trigger LANGUAGE plpgsql AS
'BEGIN INSERT INTO slt_transition_audit SELECT ''delete'', id, value FROM deleted_rows; RETURN NULL; END'

statement ok
CREATE TRIGGER slt_transition_insert AFTER INSERT ON slt_transition_target
REFERENCING NEW TABLE AS inserted_rows FOR EACH STATEMENT EXECUTE FUNCTION slt_transition_insert()

statement ok
CREATE TRIGGER slt_transition_update AFTER UPDATE ON slt_transition_target
REFERENCING OLD TABLE AS old_rows NEW TABLE AS new_rows FOR EACH STATEMENT EXECUTE FUNCTION slt_transition_update()

statement ok
CREATE TRIGGER slt_transition_delete AFTER DELETE ON slt_transition_target
REFERENCING OLD TABLE AS deleted_rows FOR EACH STATEMENT EXECUTE FUNCTION slt_transition_delete()

statement ok
INSERT INTO slt_transition_target VALUES (1, 10), (2, 20)

statement ok
UPDATE slt_transition_target SET value = value + 1 WHERE id = 1

statement ok
DELETE FROM slt_transition_target WHERE id = 2

query TII rowsort
SELECT kind, id, value FROM slt_transition_audit ORDER BY kind, id, value
----
delete 2 20
insert 1 10
insert 2 20
update-new 1 11
update-old 1 10

statement ok
DROP TABLE slt_transition_target

statement ok
DROP TABLE slt_transition_audit

statement ok
DROP FUNCTION slt_transition_delete()

statement ok
DROP FUNCTION slt_transition_update()

statement ok
DROP FUNCTION slt_transition_insert()

statement ok
CREATE TABLE slt_trigger_numeric_loop_target (id integer PRIMARY KEY, value integer)

statement ok
CREATE FUNCTION slt_trigger_numeric_loop_program() RETURNS trigger LANGUAGE plpgsql AS
'DECLARE item integer; total integer := 0; BEGIN FOR item IN REVERSE 5..1 BY 2 LOOP CONTINUE WHEN item = 3; total := total + item; EXIT WHEN item = 1; END LOOP; NEW.value := NEW.value + total; RETURN NEW; END'

statement ok
CREATE TRIGGER slt_trigger_numeric_loop_before BEFORE INSERT ON slt_trigger_numeric_loop_target
FOR EACH ROW EXECUTE FUNCTION slt_trigger_numeric_loop_program()

statement ok
INSERT INTO slt_trigger_numeric_loop_target VALUES (1, 10)

query II
SELECT id, value FROM slt_trigger_numeric_loop_target
----
1 16

statement ok
DROP TABLE slt_trigger_numeric_loop_target

statement ok
DROP FUNCTION slt_trigger_numeric_loop_program()

statement ok
CREATE TABLE slt_trigger_structured_loop_target (id integer PRIMARY KEY, value integer)

statement ok
CREATE FUNCTION slt_trigger_structured_loop_program() RETURNS trigger LANGUAGE plpgsql AS
'DECLARE item integer := 0; total integer := 0; stop integer := 0; BEGIN WHILE item < 5 LOOP item := item + 1; CONTINUE WHEN item = 2; total := total + item; END LOOP; LOOP stop := stop + 1; CONTINUE WHEN stop = 1; total := total + stop; EXIT WHEN stop = 3; END LOOP; NEW.value := total; RETURN NEW; END'

statement ok
CREATE TRIGGER slt_trigger_structured_loop_before BEFORE INSERT ON slt_trigger_structured_loop_target
FOR EACH ROW EXECUTE FUNCTION slt_trigger_structured_loop_program()

statement ok
INSERT INTO slt_trigger_structured_loop_target VALUES (1, 0)

query II
SELECT id, value FROM slt_trigger_structured_loop_target
----
1 18

statement ok
DROP TABLE slt_trigger_structured_loop_target

statement ok
DROP FUNCTION slt_trigger_structured_loop_program()

statement ok
CREATE TABLE slt_local_query_target (id integer PRIMARY KEY, value integer)

statement ok
CREATE TABLE slt_local_query_audit (changed integer)

statement ok
CREATE FUNCTION slt_local_query_program() RETURNS trigger LANGUAGE plpgsql AS
'DECLARE changed_count integer; BEGIN SELECT count(*) INTO changed_count FROM changed_rows; PERFORM 1 FROM changed_rows WHERE value > 0; INSERT INTO slt_local_query_audit VALUES (changed_count); RETURN NULL; END'

statement ok
CREATE TRIGGER slt_local_query_after AFTER UPDATE ON slt_local_query_target
REFERENCING NEW TABLE AS changed_rows FOR EACH STATEMENT EXECUTE FUNCTION slt_local_query_program()

statement ok
INSERT INTO slt_local_query_target VALUES (1, 10), (2, 20)

statement ok
UPDATE slt_local_query_target SET value = value + 1

query I rowsort
SELECT changed FROM slt_local_query_audit
----
2

statement ok
DROP TABLE slt_local_query_target

statement ok
DROP TABLE slt_local_query_audit

statement ok
DROP FUNCTION slt_local_query_program()

statement ok
CREATE TABLE slt_trigger_query_loop_target (id integer PRIMARY KEY, value integer)

statement ok
CREATE TABLE slt_trigger_query_loop_audit (value integer)

statement ok
CREATE FUNCTION slt_trigger_query_loop_program() RETURNS trigger LANGUAGE plpgsql AS
'DECLARE item integer; BEGIN FOR item IN SELECT value FROM changed_rows ORDER BY value LOOP CONTINUE WHEN item = 2; INSERT INTO slt_trigger_query_loop_audit VALUES (item); EXIT WHEN item = 3; END LOOP; RETURN NULL; END'

statement ok
CREATE TRIGGER slt_trigger_query_loop_after AFTER UPDATE ON slt_trigger_query_loop_target
REFERENCING NEW TABLE AS changed_rows FOR EACH STATEMENT EXECUTE FUNCTION slt_trigger_query_loop_program()

statement ok
INSERT INTO slt_trigger_query_loop_target VALUES (1, 1), (2, 2), (3, 3), (4, 4)

statement ok
UPDATE slt_trigger_query_loop_target SET value = value

query I rowsort
SELECT value FROM slt_trigger_query_loop_audit
----
1
3

statement ok
DROP TABLE slt_trigger_query_loop_target

statement ok
DROP TABLE slt_trigger_query_loop_audit

statement ok
DROP FUNCTION slt_trigger_query_loop_program()

statement ok
CREATE TABLE slt_transition_dml_driver (id integer PRIMARY KEY, delta integer)

statement ok
CREATE TABLE slt_transition_dml_target (id integer PRIMARY KEY, value integer)

statement ok
CREATE FUNCTION slt_transition_dml_program() RETURNS trigger LANGUAGE plpgsql AS
'BEGIN UPDATE slt_transition_dml_target SET value = slt_transition_dml_target.value + changed_rows.delta FROM changed_rows WHERE slt_transition_dml_target.id = changed_rows.id; DELETE FROM slt_transition_dml_target USING changed_rows WHERE slt_transition_dml_target.id = changed_rows.id AND changed_rows.delta = 9; RETURN NULL; END'

statement ok
CREATE TRIGGER slt_transition_dml_after AFTER UPDATE ON slt_transition_dml_driver
REFERENCING NEW TABLE AS changed_rows FOR EACH STATEMENT EXECUTE FUNCTION slt_transition_dml_program()

statement ok
INSERT INTO slt_transition_dml_driver VALUES (1, 3), (2, 9)

statement ok
INSERT INTO slt_transition_dml_target VALUES (1, 10), (2, 20)

statement ok
UPDATE slt_transition_dml_driver SET delta = delta

query II rowsort
SELECT id, value FROM slt_transition_dml_target
----
1 13

statement ok
DROP TABLE slt_transition_dml_driver

statement ok
DROP TABLE slt_transition_dml_target

statement ok
DROP FUNCTION slt_transition_dml_program()

statement ok
CREATE TABLE slt_trigger_conflict_driver (id integer PRIMARY KEY, value integer)

statement ok
CREATE TABLE slt_trigger_conflict_target (id integer PRIMARY KEY, value integer)

statement ok
CREATE FUNCTION slt_trigger_conflict_program() RETURNS trigger LANGUAGE plpgsql AS
'DECLARE step integer := NEW.value - OLD.value; BEGIN INSERT INTO slt_trigger_conflict_target VALUES (NEW.id, NEW.value) ON CONFLICT (id) DO UPDATE SET value = excluded.value + step WHERE step = 2 AND OLD.value = 5 AND NEW.value = 7; RETURN NEW; END'

statement ok
CREATE TRIGGER slt_trigger_conflict_after AFTER UPDATE ON slt_trigger_conflict_driver
FOR EACH ROW EXECUTE FUNCTION slt_trigger_conflict_program()

statement ok
INSERT INTO slt_trigger_conflict_driver VALUES (1, 5)

statement ok
INSERT INTO slt_trigger_conflict_target VALUES (1, 10)

statement ok
UPDATE slt_trigger_conflict_driver SET value = 7 WHERE id = 1

query II
SELECT id, value FROM slt_trigger_conflict_target
----
1 9

statement ok
DROP TABLE slt_trigger_conflict_driver

statement ok
DROP TABLE slt_trigger_conflict_target

statement ok
DROP FUNCTION slt_trigger_conflict_program()
